{
    "model_version": "v2_20250205",
    "calibration_type": "isotonic",
    "params": {
        "x": [
            0.0,
            0.3,
            0.5,
            0.7,
            1.0
        ],
        "y": [
            0.0,
            0.25,
            0.45,
            0.62,
            0.85
        ]
    },
    "trained_on": "2025-02-05",
    "metrics": {
        "brier_score": 0.015,
        "ece": 0.018,
        "samples": 15200
    }
}